company_brand,founded,headquarter,sector,about_company,founders,investor,amount,series,year
Hudle,1970,Delhi,Sports and Sports Technology,Hudle is a sports & fitness discovery & booking platform with 300+ sports venues and sports events/tournaments available for booking.,Suhail Narain,Survam Partners,0.0,early traction,2020-01-01
Cover it Up,1970,Chennai,Business-to-Business E-commerce,Online portal that churns out high quality products,Ronak Sarda,Angel investors,400000.0,validation,2020-01-01
BiteSpeed,1970,Gurgaon,Business-to-Business E-commerce,Chat-based commerce for E-commerce brands,"Vinayak, Kshitij Abhishek, Apoorv Sadana",Whiteboard Capital,275000.0,validation,2020-01-01
WakeFit,1970,Bangalore,Retail,Wakefitkart is a mattress manufacturing company,"Ankit Garg, Chaitanya Ramalingegowda",Sequoia Capital.,20000000.0,early traction,2020-01-01
Sreyas Holistic Remedies,1970,Hyderabad,Medtech,Sreyas Holistic Remedies operates a chain of dermatologist clinics under the brand name of Oliva,Dr Prashant Soma,Blacksoil,1000000.0,others,2020-01-01
Fleeca India,1970,Jaipur,Tyre management,FLEECA is a Tyre Care Provider company.,Tikam Jain,Bridgestone India,0.0,others,2020-01-01
M1xchange,1970,Gurgaon,Fintech,M1 an online exchange for TReDS set up under the approval RBI to facilitate discounting of invoices on a PAN India basis.,Sundeep Mohindru,"BEENEXT, Mayfield Fund",4500000.0,others,2020-01-01
Exotel,1970,Bangalore,Cloud company,Exotel provides cloud telephony services such as virtual phone numbers and telephony applications for small and medium enterprises in India.,Shivakumar Ganesan,"A91 Partners, Artha India Ventures",5000000.0,others,2020-01-01
PagarBook,1970,Bangalore,Computer Software,"Staff's Salary, Work & Attendance Management Application","Adarsh Kumar, Rupesh Mishra","Sequoia Capital, India Quotient",15000000.0,early traction,2020-01-01
PointOne Capital,1970,Bangalore,Venture Capital,Pre-seed/Seed focussed VC investor,Mihir Jha,,0.0,others,2020-01-01
Ayana,1970,Bangalore,Renewable player,Ayana Renewable Power is an Indian renewable energy platform,Shivanand N,"NIIF Ltd, CDC Group",390000000.0,others,2020-01-01
Fisdom,1970,Bangalore,Fintech,Fisdom is a fintech company that offers investment advisory services through an application.,"Anand Dalmia, Ramganesh Iyer, Subramanya S.V., Subramanya Venkat","PayU Finance India, Quona Capital",7000000.0,others,2020-01-01
Tinker Coders,1970,Noida,Education Technology,Tinker Coder is a LIVE Online Platform through which kids will learn the art of coding,Anoop Gautam,STEMROBO Technologies,0.0,validation,2020-01-01
Infinite Uptime,1970,Pune,Internet of Things,The industrial Internet platform that harnesses the power of big data & predictive analytics for data-driven decision making.,Raunak Bhinge,"Infrastructure Leasing & Financial Services Limited, Dorm Room Fund",5100000.0,early traction,2020-01-01
HappyLocate,1970,Bangalore,Software-as-a-Service,"HappyLocate is India's first One Stop Relocation Platform, transforming the way Employee Relocations are managed","Ajay Tiwari, Sainadh Duvvuru",The CoWrks Foundry,500000.0,early traction,2020-01-01
PhonePe,1970,Delhi,Fintech,PhonePe is a mobile payments application that allows the user to transfer money instantly.,"Burzin Engineer, Rahul Chari, Sameer Nigam",Flipkart,700000000.0,others,2020-01-01
Loop Health,1970,Pune,Healthcare,Loop Health is bringing ease and choice to patients seeking major medical treatments.,"Mayank Kale, Ryan Singh","Y Combinator, Sierra Ventures",2300000.0,validation,2020-01-01
NeoDocs,1970,Mumbai,Healthcare,Neodocs analyses medical reports and provides personalised health recommendations remotely.,"Anurag Meena, Nikunj Malpani, Pratik Lodha",9Unicorns Accelerator Fund,0.0,validation,2020-01-01
The ePlane,1970,Chennai,Aerospace,Transforming the mobility landscape using aerial transport.,"Satya Chakravarthy, Pranjal Mehta",Speciale Invest,0.0,validation,2020-01-01
TagMango,1970,Mumbai,Marketing and Advertising,"TagMango is a marketing and advertising app that helps influencer, and brands to partner with individuals.","Divyanshu Damani, Mohammad Hasan","XRM Media, Kevin Lin",700000.0,validation,2020-01-01
The New Shop,1970,Delhi,Retail startup,The New Shop is a chain of high speed retail stores,"Charak Almast, Aastha Almast, Mani Dev Gyawali",Huddle Accelerator,500000.0,validation,2020-01-01
MobiKwik,1970,Gurgaon,Fintech,"MobiKwik is India’s leading fintech platform, operating businesses in consumer payments, payment gateway, and financial services.","Bipin Singh, Upasana Taku","Hindustan Media Venture, Nicolas Jarrosson",7000000.0,others,2020-01-01
DebugsBunny,1970,Pune,Education Technology,DebugsBunny is the best Kids Coding Platform where kids are taught to code online by our expert teachers.,Sumit Sanjay Singare,India Angel Fund,100000.0,others,2020-01-01
BHIVE Investech,1970,Bangalore,Co-working,BHIVE is Bangalore's (India) largest Coworking space that allows entrepreneurs to take their ideas to the next level.,"Monnappa Bayavanda, Prashant Reddy, Ravindra M.K, Ravindra M.K., Shesh Paplikar, Shesh Paplikar, Sridhar Venkataraman",Blume Ventures,1000000.0,validation,2020-01-01
Rivigo,1970,Gurgaon,Supply Chain and Logistics,Rivigo is a technology-enabled logistics platform provider that offers transport services.,"Deepak Garg, Gazal Kalra","Elevation Capital, Trifecta Capital Advisors",19000000.0,others,2020-01-01
ZipLoan,1970,Delhi,Financial Services,ZipLoan is a online lending platform,"KSHITIJ Puri, Shalabh Singhal","Stride Ventures, Matrix Partners India",3000000.0,others,2020-01-01
Swipez,1970,Pune,Fintech,Swipez is a payment collection platform.,Vivek Iyer,"9Unicorns, Anicut",0.0,others,2020-01-01
Humus,1970,Bangalore,Agricultural Technology,Farmgate to Retail outlet Agri-Fresh produce supply chain,"Manjunatha T N, Shilpa Gopalaiah","Venture Catalysts, 9Unicorns, We Founders Circle.",0.0,others,2020-01-01
Artivatic.ai,1970,Bangalore,Tech company,"Artivatic's patent pending technology solves complex problems in Insurance for On-boarding, Fraud, Risk Profiling, Underwriting & claims.",Layak Singh,"SenseAI Ventures, Saurabh Chugh",0.0,others,2020-01-01
Prescinto,1970,Ahmedabad,Solar Monitoring Company,Prescinto provides solutions for solar monitoring and analytics solutions.,"Puneet Singh Jaggi, Sanjay Bhasin, Ram Menon","Startup incubator, Accelerator Venture Catalysts",0.0,validation,2020-01-01
Toppeq,1970,Mumbai,Software-as-a-Service,SaaS-based equity management platform,Nandini Sankar,,0.0,validation,2020-01-01
Bolo Indya,1970,Gurgaon,Video,"Bolo Indya is a short video & commerce platform. It allows users to create, watch and share videos & discover and avail services.","Tanmai Paul, Varun Saxena","India Accelerator, Sunil Kamath",400000.0,others,2020-01-01
Bombay Play,1970,Bangalore,Gaming,Bombay Play is a Card and Toy Company Making games for India.,"Abhas Saroha, Oliver Jones, Oliver Jones","Ramakant Sharma, Leo Capital India",1000000.0,validation,2020-01-01
FreshToHome,1970,Bangalore,Business-to-Business E-commerce,Freshtohome is an e-commerce platform for fresh and chemical-free seafood.,Shan Kadavil,Investment Corporation of Dubai (ICD),0.0,others,2020-01-01
KIKO TV,1970,Mumbai,Video,KIKO TV is an AI-based short live video e-commerce platform.,"Shivam Varshney, Alok Chawla","9Point8 Capital, Sunil Kumar Singhvi",0.0,validation,2020-01-01
Atomberg Technologies,1970,Mumbai,Consumer Goods and Services,"Atomberg Technology aspires to be the ""Tesla"" of the world of household appliances","Manoj Meena, Sibabrata Das","Sandeep Tandon, Survam Partners",9000000.0,early traction,2020-01-01
DealShare,1970,Jaipur,Business-to-Business E-commerce,DealShare is a Social Commerce Startup,"Sankar Bora, Sourjyendu Medda, Vineet Rao","Falcon Edge Capital, Omidyar Network",21000000.0,early traction,2020-01-01
Smallcase,1970,Bangalore,Fintech,Changing how India invests in equities,"Anugrah Shrivastava, Rohan Gupta, Vasanth Kamath","WEH Ventures, BEENEXT",0.0,others,2020-01-01
CueMath,1970,Bangalore,Education Technology,Cuemath is an engaging ‘learning-by-doing’ methodology for students with face-to-face sessions from highly-trained Cuemath teachers.,Manan Khurma,"Sequoia Capital India, CapitalG",40000000.0,early traction,2020-01-01
Gamerji,1970,Ahmedabad,Gaming,"Gamerji is an online esports gaming platform where tournaments are created for different games such as PUBG, COD, Free Fire etc.","Soham Thacker, Valay Patel, Varun Gajjar",La Gajjar Group.,0.0,validation,2020-01-01
5C Network,1970,Bangalore,Healthcare,"5C is India's first Diagnostics Network, making Radiodiagnosis more Accessible, Affordable and Accurate",Kalyan Sivasailam,"Axilor Ventures, Unitus Ventures",1200000.0,early traction,2020-01-01
Ethereum Push Notification Service,1970,Mumbai,Blockchain startup,EPNS is a decentralized notification protocol,"Harsh Rajat, Richa Joshi",Prolific angel investors,750000.0,validation,2020-01-01
Mihup,1970,Kolkata,Conversational AI platform,Intelligence-based personal mobile assistant app,"Biplab Chakraborty, Sandipan Chattopadhyay, Sandipan Mandal, Tapan Barman","Ideaspring Capital, Accel",1500000.0,early traction,2020-01-01
RuralBasket,1970,Tirunelveli,Business-to-Business E-commerce,Naturally grown and healthy products directly from farmers.,Palani Rajan,Nativelead Foundation,500000.0,others,2020-01-01
WayCool Foods,1970,Chennai,Agricultural Technology,"WayCool has adopted a tech-enabled supply chain approach to produce staples like rice, dairy, and value added products.","Karthik Jayaraman, Sanjay Dasari","FMO, IndusInd Bank",7800000.0,others,2020-01-01
Infra.Market,1970,Thane,Real Estate and Property Technology,Hella Infra Market develops an online procurement marketplace intended to serve the real estate and construction materials industry.,"Aaditya Sharda, Souvik Sengupta","Trifecta Capital Advisors, Nexus Venture Partners",20000000.0,early traction,2020-01-01
Info Edge Venture,1970,Noida,Venture Capital,"Info Edge provides online recruitment, matrimonial and real estate classifieds, and related services.",Sanjeev Bikhchandani,Lightbox,50000000.0,others,2020-01-01
Clovia,1970,Noida,Business-to-Business E-commerce,Clovia is the online lingerie retailer,"Neha Kant, Pankaj Vermani","Golden Birch Investments, She Capital",4000000.0,early traction,2020-01-01
Codingal,1970,Bangalore,Education Technology,Coding education platform for K-12 students,"Satyam Baranwal, Vivek Prakash","Pras Hanuma, Rebright Partners, Java Capital, and GSF Accelerator.",560000.0,validation,2020-01-01
CRED,1970,Bangalore,Financial Services,CRED is a members-only app that rewards the user with exclusive rewards for paying credit card bills.,Kunal Shah,"General Catalyst, Ribbit Capital",80000000.0,early traction,2020-01-01
Vistaar Finance,1970,Bangalore,Financial Services,The preferred full range Financial Services provider to the Small Business segment focused on rural and semi urban markets.,"Brahmanad, Ramakrishna Nishtala",FMO,30000000.0,others,2020-01-01
Let's Dive,1970,Bangalore,Software-as-a-Service,A platform for remote employee engagement and building team culture,"Nitesh Agrawal, Om Prakash",Surge,1700000.0,others,2020-01-01
Habitat,1970,,Education Technology,"Habitat, a social learning edtech platform for civil service aspirants","Rohit Pande, Shikhar Sachan","Unitus Ventures, Whiteboard Capital",600000.0,validation,2020-01-01
SAWO Labs,1970,Mumbai,Software-as-a-Service,Providing Secure Authentication solutions to Apps and Websites. Eliminating Passwords and OTPs for a seamless User Experience.,Prabhat Sahu,"StartupXseed Ventures, 100X.VC",600000.0,validation,2020-01-01
Signzy,1970,Bangalore,Artificial Intelligence,Signzy are creating 'building blocks for a Digital Trust system.,"Ankit Ratan, Ankur Pandey, Arpit Ratan","Stellaris Venture Partners, Mastercard",3000000.0,others,2020-01-01
KopyKitab,1970,Bangalore,Education Technology,"Kopykitab is an India-based digital library that provides eBooks, and digital content in school and higher education.","Amit Shrivastava, Sumeet Verma","Paula Mariwala, Siddharth Anand",0.0,others,2020-01-01
Kyt,1970,Singapore,Education Technology,Holistic education for every child | Individual and small group live classes for ages 5 - 15 years,"Bhavik Rathod, Tripti Ahuja",Sequoia Capital India’s Surge,2500000.0,others,2020-01-01
Raskik,1970,,Fusion beverages,All new fusion-flavour fruit juices with the goodness of coconut and taste of India's finest fruits.,"Vikas Chawla, Abhay Parnerkar, Satyajit Ram","Venture Catalysts, 9Unicorns",1000000.0,early traction,2020-01-01
GetWork,1970,Gurgaon,Human Resources and HR Technology,GetWork is a campus recruiting platform to post your jobs and hire across dozens of colleges at once.,Rahul Veerwal,India Accelerator,40000.0,validation,2020-01-01
Mobile Premier League (MPL),1970,Bangalore,Gaming,Mobile Premier League is a skill-based eSports platform used to offer cash prizes while playing games.,"Sai Srinivas Kiran G, Shubham Malhotra","Pegasus Tech Ventures, Base Partners",500000.0,early traction,2020-01-01
Pravasirojgar,1970,,Recruitment and Staffing,Initiative for blue-collar job workers,Sonu Sood,GoodWorker.,33000000.0,others,2020-01-01
Omatra Hotels,1970,Kolkata,Hospitality,Omatra is very new hotel management firm recently registered as Omatra Hospitality Services Private Limited.,"NAVEED AHAMED, SYED SAQQA ABBAS",Capify,0.0,validation,2020-01-01
Awign,1970,Bangalore,Recruitment and Staffing,Operations and manpower outsourcing startup,"Annanya Sarthak, Gurpreet Singh, Praveen Sah","Unitus Ventures, Work10M",0.0,early traction,2020-01-01
NewsReach,1970,Gujarat,Media and Entertainment,NewsReach India offers partner publications a digital footprint and monetisation of their content via advertisements.,"Darshan Shah, Soniya Kundnani","Mumbai Angels, JITO Angel Network.",1500000.0,validation,2020-01-01
Cashfree,1970,Bangalore,Fintech,Cashfree is a payments and banking technology company that enables businesses in India to collect payments online and make payouts.,"Akash Sinha, Reeju Datta","George Osborne, Smilegate Investment",35000000.0,early traction,2020-01-01
Credgenics,1970,Delhi,Fintech,"Credgenics is a tech-enabled platform backed by Titan Capital, helping fintech lenders and Banks in their critical NPA reduction","Anand Agrawal, Mayank Khera, Rishabh Goel","Accel India, Breadlake Ventures",3000000.0,early traction,2020-01-01
GeoIQ,1970,Bangalore,Artificial Intelligence,"Map-based intelligent platform with single-click access to street-level location data - demographics, competitions, movements - for retail.","Devashish Fuloria, Tusheet Shrivastava, Ankita Thakur","Ankur Mittal, Mitesh Shah",300000.0,validation,2020-01-01
Country Delight,1970,Haryana,Dairy,Country Delight produces and distributes milk intended to provide good quality and unadulterated milk at doorstep.,"Chakradhar Gade, Nitin Kaushal","IIFL Asset Management, Matrix Partners",25000000.0,early traction,2020-01-01
Quintype,1970,Bangalore,Content management,"A technology company that focus on building a suite of digital publishing solutions to simplify content creation, distribution, audience engagement",Chirdeep Shetty,IIFL AMC,3500000.0,early traction,2020-01-01
CARS24,1970,Haryana,Retail,CARS24 is an India-based platform for selling used cars.,"Mehul Agrawal, Ruchit Agarwal, Vikram Chopra","Global Car Group, Freemark holdings",200000000.0,early traction,2020-01-01
Astrogate Labs,1970,Bangalore,Space Technology and Defense,Astrogate Labs provides high-quality products related to space infrastructure.,,"Venture Catalysts, Speciale Invest",0.0,others,2020-01-01
Power Gummies,1970,Delhi,Healthcare,Power Gummies are a team of passionate givers who are dedicated to catering nutritional supplements,Divij Bajaj,Venture Catalysts,0.0,others,2020-01-01
Cityflo,1970,Mumbai,Transportation and Mobility,Cityflo is an urban transportation app that provides comfortable and economical buses for daily commute.,"Advaith Vishwanath, Ankit Agrawal, Jerin Venad, Rushabh Shah, Sankalp Kelshikar, Subhash Sundaravadivelu","Anupam Mittal, India Quotient",7000000.0,early traction,2020-01-01
AlgoBulls,1970,Mumbai,Financial Services,Algobulls is a state-of-the-art Trading Platform where customers are provided with Fully Automated Algorithmic Trading,"Pushpak Dagade, Jimmit Patel and Suraj Bathija",Venture Catalysts,200000.0,others,2020-01-01
Credgenics,1970,Gurgaon,Fintech,"Credgenics is a tech-enabled platform backed by Titan Capital, helping fintech lenders and Banks in their critical NPA reduction","Anand Agrawal, Mayank Khera, Rishabh Goel","Accel India, Breadlake Ventures",3000000.0,early traction,2020-01-01
Inntot,1970,Kochi,Tech company,"Inntot Technologies, is a technology driven company.",Rajith Nair,Unicorn India Ventures,0.0,others,2020-01-01
Ensuredit,1970,Gurgaon,Fintech,ENSUREDIT enables and empowers end customers and Insurance Intermediaries with AI-based product platforms for transformational customer experience.,"Amit, Rohit Sadhu, and Vikas Ranga",Venture Catalysts,300000.0,early traction,2020-01-01
Shipsy,1970,Gurgaon,Artificial Intelligence,Shipsy's platform enables data driven decision making enhancing visibility and operational efficiency for Supply Chain industry,"Dhruv Agrawal, Himanshu Gupta, Soham Chokshi","DTDC, Udaan Angel Partners",6000000.0,early traction,2020-01-01
ERPNext,1970,Mumbai,Tech company,"ERPNext is an Open Source, Online ERP solution which includes Accounting, CRM, Inventory, Purchasing, HR, Support and a lot more.",Rushabh Mehta,Rainmatter,1000000.0,others,2020-01-01
LightSpeedAI,1970,Bangalore,Photonics startup,Developer of an optoelectronic processor designed to accelerate AI computations.,"Rohin Y, PV Ramana","YourNest, growX ventures",0.0,others,2020-01-01
Grip Invest,1970,Gurgaon,Fintech,Grip is an investment platform that allows retail investors to make small ticket investments in physical assets that earn lease income.,"Nikhil Aggarwal, Vivek Gulati",Gemba Capital,0.0,early traction,2020-01-01
Unacademy,1970,Bangalore,Education Technology,Unacademy is an online learning platform providing educational content such as video lectures and examinations.,"Gaurav Munjal, Hemesh Singh, Roman Saini, Sachin Gupta","Dragoneer Investment Group, Tiger Global Management",0.0,others,2020-01-01
Yellow Classes,1970,Gurgaon,Education Technology,New-age fun-learning platform for kids.,"Arpit Mittal, Anshul Gupta",India Quotient,1300000.0,early traction,2020-01-01
Plum,1970,Bangalore,Healthcare,High quality health insurance and health benefits,"Abhishek Poddar, Saurabh Arora","Surge, Tanglin Venture Partners",4100000.0,others,2020-01-01
STAGE,1970,Indore,Entertainment,STAGE is an Indian language content platform for artist-led entertainment.,"Shashank Vaishnav, Vinay Singhal, Parveen Singhal",Venture Catalysts,1000000.0,others,2020-01-01
Nykaa,1970,Mumbai,"Cosmetics, Personal Care, and Beauty Products",Nykaa is an online marketplace for different beauty and wellness products.,Falguni Nayar,"Alia Bhatt, Katrina Kaif",0.0,others,2020-01-01
Kaagaz Scanner,1970,,Scanning app,Kaagaz Scanner is the Indian replacement to banned Cam Scanner App.,"Snehanshu Gandhi, Gaurav Shrishrimal",Pravega Ventures,575000.0,others,2020-01-01
NIRA,1970,Bangalore,Fintech,"NIRA promotes financial inclusion by creating simple, transparent products that empower individuals to live a life of choice and freedom.","Rohit Sen, Nupur Gupta","Techstars Bangalore Accelerator, Techstars",1000000.0,others,2020-01-01
Prolixr,1970,Gurgaon,"Cosmetics, Personal Care, and Beauty Products",A premium skincare brand committed towards building innovative skin care wellness.,"Aditya Sharma, Jayesh Hans","Alfa Ventures, Divij Bajaj",0.0,validation,2020-01-01
Byju's,1970,Bangalore,Education Technology,BYJU'S is an educational technology company that develops personalized learning programs for K-12 students.,"Byju Raveendran, Divya Gokulnath","Owl Ventures, Tiger Global Management",200000000.0,others,2020-01-01
DaMENSCH,1970,Bangalore,Business-to-Business E-commerce,DaMENSCH is a designer and seller of men's apparel.,"Anurag Saboo, Gaurav Pushkar","Whiteboard Capital, Matrix Partners India",6000000.0,others,2020-01-01
Country Delight,1970,Haryana,Food and Beverages,Country Delight produces and distributes milk intended to provide good quality and unadulterated milk at doorstep.,"Chakradhar Gade, Nitin Kaushal","Orios Venture Partners, Matrix Partners India",25000000.0,early traction,2020-01-01
SignalX,1970,Hyderabad,Artificial Intelligence,SignalX offers an artificial intelligence-powered SaaS platform,"Govind Balachandran, Zakir Wahab, Piyush Arora","9Unicorns, 3Lines VC, Hyderabad Angels",800000.0,validation,2020-01-01
Lancify,1970,Bangalore,Education Technology,Lancify is building the world's strongest young workforce,"Gowtham Sundaresan, Azan Barodawala","Techstars, Techstars Bangalore Accelerator",300000.0,others,2020-01-01
Krimanshi,1970,Jodhpur,Biotechnology company,Krimanshi aims to increase rural income by improving the productivity of Indian cattle with better quality feed.,Nikhil Bohra,"Rajasthan Venture Capital Fund, AIM Smart City",600000.0,validation,2020-01-01
Instoried,1970,Bangalore,Artificial Intelligence,Instoried is an augmented writing platform which improves customer interest and engagement.,"Sharmin Ali, Sutanshu Raj","Venture Catalysts, SOSV",1000000.0,early traction,2020-01-01
PlayerzPot,1970,Mumbai,Gaming,"Favorite fantasy cricket, football & kabaddi leagues online to win daily cash and prizes","Yogesh, Mitesh Gangar",,3000000.0,early traction,2020-01-01
Instamojo,1970,Bangalore,Fintech,"Instamojo is an on-demand payments platform that enables entrepreneurs to build, manage, and grow their business online.","Aditya Sengupta, Akash Gehani, Harshad Sharma, Sampad Swain","BASE, Gunosy Capital",0.0,others,2020-01-01
Turtlemint,1970,Mumbai,Healthcare,Turtlemint has built Indian personalized insurance platform,"Anand Prabhudesai, Dhirendra Mahyavanshi, Kunal Shah","Nexus Venture Partners, Dream Incubator",30000000.0,others,2020-01-01
Arata,1970,Delhi,Business-to-Business E-commerce,Arata is an e-commerce site for beauty products and cosmetics.,"Dhruv Madhok, Dhruv Bhasin",DSG Consumer Partners,1000000.0,early traction,2020-01-01
MPL,1970,Bangalore,Gaming,Mobile Premier League is a skill-based eSports platform used to offer cash prizes while playing games.,"Sai Srinivas Kiran G, Shubham Malhotra","Pegasus Tech Ventures, Base Partners",5000000.0,others,2020-01-01
True Balance,1970,Gurgaon,Fintech,True Balance is a digital wallet that enables users to access utility bill payment and other financial products.,"Cheolwon Lee, Jay Yi, Martin Lee","IBK Capital, SB Partners",28000000.0,others,2020-01-01
Thrive,1970,Mumbai,Food and Beverages,"Thrive is all-in-one restaurant ordering suite for table ordering, pickup, and delivery with marketing in-built.","Dhruv Dewan, Krishi Fagwani","Whiteboard Capital, Ahimsa Capital",0.0,early traction,2020-01-01
Kitchens Centre,1970,Delhi,Real Estate and Property Technology,Kitchens Centre offers turnkey solutions to cloud kitchens.,Lakshay Jain,"Jonathan Swanson, Ankush Gera",0.0,early traction,2020-01-01
Prescribe,1970,Chennai,Healthcare,Provide online services to patients by leveraging WhatsApp.,Nived Narayanan,Titan Capital,100000.0,others,2020-01-01
Nepra,1970,Ahmedabad,"Renewable Energy, Environmental Services, and Clean Technology",NEPRA Resource Management provides waste management solutions in India.,Sandeep Patel,"Asha Impact, Aavishkaar Venture Capital",18000000.0,early traction,2020-01-01
inFeedo,1970,Gurgaon,Software-as-a-Service,"inFeedo is a predictive people analytics company helping 300,000+ employees in 100+ companies make their voice feel heard and valued.",Tanmaya Jain,"Peyush Bansal, Ritesh Malik",3200000.0,others,2020-01-01
Shilpa Sciences,1970,Bangalore,Healthcare,Shilps Sciences is a healthtech platform that claims to have solved gene editing by accelerating single gene cell applications.,Ashwin Lal,AngelList India,0.0,early traction,2020-01-01
Arzooo,1970,Bangalore,Technology Startup,"B2B retail tech platform transforming 300,000+ SMEs in electronics space with its flagship ""Go Store"" product","Khushnud Khan, Rishi Raj Rathore","3Lines, Jabbar Internet Group",0.0,others,2020-01-01
MindTickle,1970,Pune,Software-as-a-Service,MindTickle offers the industry's most comprehensive sales readiness solution for closing knowledge and skill gaps in customer-facing teams.,"Deepak Diwakar, Krishna Depura, Mohit Garg, Nishant Mungali","Canaan Partners, NewView Capital",100000000.0,others,2020-01-01
Slice,1970,Bangalore,Fintech,Slice is a card for first-time credit card users. They are inventing the future of finance for young Indians,"Deepak Malhotra, Rajan Bajaj","Better Capital, Gunosy",5000000.0,others,2020-01-01
Rapawalk,1970,Bangalore,Business-to-Business E-commerce,Rapawalk is an online brand that offers a personalized service of creating your own shoes.,"Kashif Mohammad, Aravind Maddireddy","Sanjay Ramakrishnan, Ravi Garikipati",300000.0,validation,2020-01-01
Oga Fit's,1970,Bangalore,Fitness startup,The new-age home workout app that gives you an unmatched boutique digital fitness studio experience.,Ashish Rawat,9Unicorns,0.0,early traction,2020-01-01
LAVAL,1970,Bangalore,"Cosmetics, Personal Care, and Beauty Products","Laval Cosmetics, affordable makeup for all ages","Shrishti, Prithika",Jazal Group,0.0,early traction,2020-01-01
Stride Ventures,1970,Delhi,Venture Capital,Stride Ventures is a venture capital firm in India which aims to invest in innovative startups across the country.,Ishpreet Gandhi,Small Industries Development Bank of India,80000000.0,others,2020-01-01
BlackSoil,1970,Mumbai,Fintech,Blacksoil Advisory is an independent boutique advisory firm.,Ankur Bansal,,10000000.0,others,2020-01-01
