company_brand,founded,headquarter,sector,about_company,founders,investor,amount,series,year
GoBolt,1970,Gurgaon,Supply Chain and Logistics,"GoBOLT is a tech-logistics company operating in Line Haul & Short Haul Trucking, creating value through dis-intermediation, increased asset utilization and extensive use of technology.","Naitik Baghla, Parag Aggarwal, Sumit Sharma","Paragon Partners, Aavishkaar Capital",20000000.0,early traction,2021-01-01
Loco,1970,Bangalore,Gaming,Loco is India's leading live game streaming app.,"Anirudh Pandita, Ashwin Suresh","Krafton, Lumikai",9000000.0,validation,2021-01-01
Auric,1970,Delhi,HealthCare,Contemporary Beauty & Wellness Brand Based on Ayurveda,Deepak Agarwal,Venture Catalysts,2000000.0,early traction,2021-01-01
Edmingle,1970,Bangalore,Education Technology,Edmingle is a platform for all educators who want to launch their courses and sell them online.,Gaurav Doshi,"Indovation Fund, Mumbai Angels",300000.0,others,2021-01-01
Slice,1970,Bangalore,Fintech,"Slice is India's best credit card challenger to pay bills, manage expenses, and unlock rewards.",Rajan Bajaj,"Gunosy, Blume Ventures",20000000.0,others,2021-01-01
Humit,1970,Bangalore,Music and Music Streaming,Humit is a social networking app for music sharing and discovery.,"Rohit Ganapathy, Prithvi Sankar, Ishaan Negi",Antler India,0.0,validation,2021-01-01
Airblack,1970,Gurgaon,Technology Startup,Airblack is on a mission to help people convert their passion to a livelihood.,"Videt Jaiswal, Vaibhav Raj Gupta","Edge Ventures, Elevation Capital",5200000.0,early traction,2021-01-01
NIRAMAI,1970,Bangalore,HealthCare,"NIRAMAI has developed a novel breast cancer screening solution that uses Thermalytix, i.e. machine intelligence over thermography images.",Geetha Manjunath,CDC Group,0.0,others,2021-01-01
Intervue,1970,Delhi,Software-as-a-Service,World's fastest collaborative environment to take tech interviews.,"Rahul Arora, Pushpender Singh Rautela","Titan Capital, Kunal Shah",0.0,validation,2021-01-01
Nestroots,1970,Gurgaon,Fashion and Lifestyle,"Ottoman, Stool, Brass Kitchen Solutions, Masala Box, Roti Box, Bar Accessories and Many Gifting Options at Nestroots.",Chhavi Singh,We Founder Circle,100000.0,validation,2021-01-01
Detect Technologies,1970,Chennai,Automation,Detect Technologies is a leading Industrial AI company that is building innovative solutions and cutting-edge technology for the industrial ecosystem.,Daniel Raj David,"Accel Partners, Elevation Capital",12000000.0,others,2021-01-01
CredR,1970,Bangalore,Automotive,CredR is India’s Most Trusted Used Two-Wheeler Consumer Brand that leverages Technology & Processes to simplify the Used Two-wheeler Market.,Sasidhar Nandigam,"Yamaha Motors, Omidyar Network India, Eight Roads Ventures",6500000.0,others,2021-01-01
Fourth Partner Energy,1970,Hyderabad,Solar,"Fourth Partner Energy is India’s leading distributed solar energy firm focusing on building and financing solar projects across the private and public sectors for commercial, industrial and institutional entities.",Vivek Subramanian,"Norfund, The Rise Fund",125000000.0,others,2021-01-01
TABLT,1970,Kolkata,HealthCare,TABLT [Previously Sabse Sasta Dukaan] is one of India's most trusted online pharmacy dealing in medicines and other healthcare products.,Anish Agarwal,Siti Cable,3000000.0,others,2021-01-01
Hesa,1970,Hyderabad,Technology Startup,HESA is connecting Bharat with India and India with Bharat Phygitally. We are bridging the gap for the world’s largest customer base that resides in rural India.,"Vamsi Udayagiri, Hema Nandiraju","Venture Catalysts, 9unicorns",2000000.0,validation,2021-01-01
Powerhouse91,1970,Gurgaon,Consumer Goods and Services,"A tech-driven company that acquires, operates, and scales outstanding ecommerce brands in India.","Shashwat Diesh, Aqib Mohammed",Crossbeam Venture Partners,0.0,validation,2021-01-01
Nalanda Learning,1970,Kolkata,Education Technology,India's 1st Online Preschool with Blended Learning Model,Tamal Mukherjee,Aavishkaar Capital,5000000.0,others,2021-01-01
Chargeup,1970,Delhi,Renewable Energy,"""Battery as a Service"" for 3 wheeler & 2 wheelers","Varun Goenka, Akshay Kashyap",Mapmyindia,0.0,early traction,2021-01-01
Knackit,1970,Bangalore,Technology Startup,Knackit is a talent sharing platform where users can showcase and monetize their artistry.,"Pranjal Kumar, Akanksha Bhardwaj",Jyoti Bansal,100000.0,others,2021-01-01
Treebo Hotels,1970,Bangalore,Hospitality,Treebo Hotels is India's most loved hotel chain in the premium-budget segment.,"Sidharth Gupta, Kadam Jeet Jain, Rahul Chaudhary",Accor,16000000.0,early traction,2021-01-01
Raptee Energy,1970,Chennai,Automotive,Raptee Energy Inc. is looking to accelerate the transition to smart and sustainable mobility!,Phunith Kumar,,700000.0,others,2021-01-01
Meddo,1970,Gurgaon,HealthCare,Meddo (Arctern Healthcare) are re-defining how primary and secondary healthcare is provided in India through a connected care delivery platform.,"Saurabh Kochhar, Dr Naveen Nishchal","SRI Capital, Picus Capital, Alkemi Capital",6000000.0,others,2021-01-01
Supertails,1970,Bangalore,Pet Care and Veterinary Services,Supertails is building a digital pet care platform which offers expert led healthcare services and products.,"Vineet Khanna, Varun Sadana, Aman Tekriwal","Saama Capital, DSG Consumer Partners",2600000.0,early traction,2021-01-01
SkilloVilla,1970,Bangalore,Education Technology,Mission to support young graduates in enhancing their learnings and transform them into big earnings.,"Ronak Agrawal, Rajat Agrawal, Deepak Kharol",Titan Capital,300000.0,validation,2021-01-01
Cancer Clinics,1970,Telangana,HealthCare,"Cancer Helpline is a source of information and support, helping with all the things that people affected by cancer want and need.","Sonali Srungaram, Sasi Sunkara",Axilor,1500000.0,early traction,2021-01-01
Velocity,1970,Bangalore,Fintech,Velocity provides revenue-based-financing to online businesses. It aims to build the future of banking and financial services for new age businesses in India.,"Abhiroop Medhekar, Atul Khichariya, Saurav Swaroop",Valar Ventures,1300000.0,validation,2021-01-01
Happy Jars,1970,Delhi,Food and Beverages,"Manufacture and retail a delicious range of all-natural nut butters, made without oil, sugar or preservatives.","Surabhi Talwar, Vikram Sekhar",Inflection Point Ventures,400000.0,validation,2021-01-01
Inshorts,1970,Noida,Media and Entertainment,Inshorts is a news aggregator application that collects and summarizes news based on user behavior and preferences.,"Anunay Pandey, Azhar Iqubal, Deepit Purkayastha","Addition, SIG Global India Fund",40000000.0,others,2021-01-01
ExtraaEdge,1970,Pune,Marketing and Advertising,Data Science powered - Admission & Marketing CRM Automation for Education Enrolments,"Abhishek Ballabh, Sushil Mundada","9Unicorns Accelerator Fund, Indian Angel Network",1000000.0,early traction,2021-01-01
Zotalabs,1970,Pune,Technology Startup,Zotalabs gives the power of Emerging Technology to your digital automation with our easy to use APIs.,"Nausherwan Shah, Wasim Khan",Alfa Ventures,1250000.0,validation,2021-01-01
Voiro,1970,Bangalore,Marketing and Advertising,Voiro is the first all-in-one revenue management suite exclusively for ad-led digital publishers across media.,"Anand Gopal, Kavita Shenoy",1Crowd,1800000.0,early traction,2021-01-01
Dream Sports,1970,Mumbai,Gaming,"Dream Sports is India’s leading sports technology company with brands such as Dream11, FanCode, DreamX and DreamSetGo in its portfolio.","Bhavit Sheth, Harsh Jain","TCV, D1 Capital Partners, Falcon Edge.",400000000.0,others,2021-01-01
Safex Chemicals,1970,Delhi,Agricultural Technology,Safex Chemicals India Ltd is a leading company having a strong foothold in the Indian agrochemicals industry.,"SK Jindal, SK Chaudhary",BanyanTree Finance Pvt. Ltd.,50000000.0,others,2021-01-01
Instoried,1970,Bangalore,Media and Entertainment,Instoried is an augmented writing platform which improves customer interest and engagement.,"Sharmin Ali, Sutanshu Raj","EXPERT DOJO, Mumbai Angels",0.0,others,2021-01-01
Rupifi,1970,Bangalore,Fintech,Rupifi operates a software-as-a-service (SaaS) firm focussed on financial products.,Anubhav Jain,Quona Capital,4100000.0,early traction,2021-01-01
Moneyboxx,1970,Mumbai,Fintech,Moneyboxx Finance provides easy access to financing to the deserving micro enterprises.,Deepak Aggarwal,"Ashv Finance, BlackSoil Capital",3000000.0,others,2021-01-01
CityMall,1970,Gurgaon,Business-to-Business E-commerce,CityMall is a social e-commerce platform that sells lifestyle and curated products via peer-to-peer referrals on WhatsApp.,"Angad Kikla, Divij Goyal","WaterBridge Ventures, SAIF Partners",11000000.0,early traction,2021-01-01
Janani,1970,Bangalore,Healthcare,Janani.ai is a fertility care provider.,Nilay Mehrotra,"Sweta Rau, 9Unicorns Accelerator Fund",1000000.0,validation,2021-01-01
ReshaMandi,1970,Bangalore,Agricultural Technology,India's 1st award winning technology led digital ecosystem for Silk,Utkarsh Apoorva,"Omnivore, Strive Ventures",1700000.0,validation,2021-01-01
Bombay Shaving Company,1970,Delhi,Lifestyle,"Bombay Shaving Company is a consumer goods company that focuses on developing a range of shave care, beard care, and skincare products.","Deepu Panicker, Raunak Munot, Rohit Jaiswal, Shantanu Deshpande","Rajesh Sud, KULDEEP JAIN",2000000.0,others,2021-01-01
DotPe,1970,Gurgaon,Fintech,DotPe is a technology start-up providing a commerce and payments platform to offline enterprise businesses.,"Anurag Gupta, Gyanesh Sharma, Shailaz Nag","PayU, Google",27000000.0,early traction,2021-01-01
Homingos,1970,Bangalore,Augmented Reality and AR/VR,Homingos is an Augmented reality (AR)-based social networking platform.,"Shourya Agarwal, Malhar Patil, Rajat Gupta","Sundi Natarajan, Srinivas Anumolu",0.0,others,2021-01-01
Anar Business Community,1970,Mumbai,Technology Startup,Anar is a communications and networking platform for businesses around the world.,"Nishank Jain, Sanjay Bhat","Titan Capital, First Cheque",0.0,others,2021-01-01
Five Star Finance,1970,Chennai,Fintech,Five-Star is a Registered Non Banking Finance Company (NBFC) with Reserve Bank of India (RBI).,V K Ranganathan,"TPG Capital Asia, Epiq Capital",234000000.0,others,2021-01-01
Settlrs,1970,Bangalore,Rental Services,"A B2B rental services company for furniture, home appliances, electronic and IT infrastructure.","Gaurav Ranebennur, Nishanth Janadri",MaGEHold Pte. Ltd.,0.0,early traction,2021-01-01
BYJU'S,1970,Bangalore,Education Technology,BYJU'S is an educational technology company that develops personalized learning programs for K-12 students.,"Byju Raveendran, Divya Gokulnath","BlackRock, Owl Ventures",460000000.0,early traction,2021-01-01
Annapurna Finance,1970,Bhubaneswar,Fintech,Annapurna Microfinance is a microfinance venture that works for the financial and economic upliftment of underserved and unreached women.,Gobinda Chandra Pattnaik,"Asian Development Bank, Oman India Joint Investment Fund",30000000.0,others,2021-01-01
HealthPlix,1970,Bangalore,HealthCare,HealthPlix is a healthtech startup,"Raghuraj Sunder Raju, Sandeep Gudibanda","JSW Ventures, Kalaari Capital",13500000.0,early traction,2021-01-01
Masai School,1970,Bangalore,Education Technology,Masai School is a job-oriented software training services.,Prateek Shukla,"Unitus Ventures, Omidyar Network India",5000000.0,early traction,2021-01-01
Bewakoof,1970,Mumbai,Fashion and Lifestyle,"Society perceives Bewakoof as stupid.But what does society call Bewakoof?Often, it’s anything different or anything that’s done differently.",Prabhkiran Singh,"IvyCap Ventures, Pratithi Investment Trust",4000000.0,others,2021-01-01
IndiaLends,1970,Delhi,Fintech,IndiaLends is a digital lending and borrowing marketplace.,"Gaurav Chopra, Mayank Kachhwaha","ACPI Investments, AdvantEdge Founders",5100000.0,others,2021-01-01
Stelis Biopharma,1970,Bangalore,BioTechnology,Stelis Biopharma is a vertically integrated biopharmaceutical company.,Pudhucode Radhakrishnan Kannan,"RouteOne, Mankekar Family Office",195000000.0,early traction,2021-01-01
Tilt,1970,Bangalore,Rental Services,A bike-share for Indian campuses,Deepak VS,Y Combinator,125000.0,others,2021-01-01
NeoDove,1970,Jaipur,Artificial Intelligence,"Neodove is an AI-powered, end to end tech-enabled customer communication and reporting solution.",Aprit Khandelwal,India Quotient,15000000.0,validation,2021-01-01
Zaara Biotech,1970,Kottayam,BioTechnology,India's First Algal-seaweed Biotechnology Students' Startup in collaboration with ICAR- Central Institute of fisheries and Technology,Najeeb Bin Haneef,TCN International Commerce,10000000.0,others,2021-01-01
KreditBee,1970,Bangalore,Fintech,KreditBee is a digital lending platform developed to assist young professionals with their personal finances.,"Karthikeyan Krishnaswamy, Madhusudan Ekambaram, Wan Hong","Alpine Capital, PremjiInvest",75000000.0,validation,2021-01-01
True Balance,1970,Gurgaon,Fintech,True Balance is a digital wallet that enables users to access utility bill payment and other financial products.,"Cheolwon Lee, Jay Yi, Martin Lee","Bon Angels Venture Partners, Daesung Private Equity",10000000.0,others,2021-01-01
Muvin,1970,Bangalore,Fintech,Youth Neobank enabling financial solutions for the teenagers and young people,Mukund V Rao,,1000000.0,validation,2021-01-01
Purplle,1970,Mumbai,"Cosmetics, Personal Care, and Beauty Products","Purplle is an online store selling cosmetics, fragrances, skin, and hair care products.","Manish Taneja, Rahul Dash","Spring Marketing Capital, Verlinvest",45000000.0,others,2021-01-01
FloBiz,1970,Bangalore,Technology Startup,India’s first neobusiness platform,Rahul Raj,Elevation Capital,10000000.0,early traction,2021-01-01
Jeevam Health,1970,Delhi,Healthcare,Jeevam Health is an Online Medical Clinic to Cure Root Cause of Chronic Issues in India.,"Kamran alam, Piyush vishwakarma",Y Combinator,1500000.0,validation,2021-01-01
NewLink Group,1970,Beijing,Technology Startup,Developer of an energy management and transportation digital platform designed to streamline the energy supply chain,"Yang Wang, Zhen Dai",Bain Capital,200000000.0,others,2021-01-01
OZiva,1970,Mumbai,Healthcare,OZiva is a plant-based Clean Nutrition Brand.,"Aarti, Mihir Gadani","F-Prime Capital, Eight Roads Ventures India",12000000.0,early traction,2021-01-01
Blive,1970,Panaji,Tourism,B: Live is an electric vehicle tourism startup.,"Samarth Kholkar, Sandeep Mukherjee","Mumbai Angels, DNA Entertainment Networks",1000000.0,early traction,2021-01-01
Nazara Technologies,1970,Mumbai,Gaming,"Nazara Technologies develops mobile content such as games, themes, wallpapers, and multimedia.",Nitish Mittersain,"Hornbill Capital Advisers, Plutus Wealth Management",30000000.0,others,2021-01-01
Euler Motors,1970,Delhi,Automotive,Electric Light Commercial Vehicle,Saurav Kumar,"ADB Ventures, Jetty Ventures",2600000.0,early traction,2021-01-01
Pixxel,1970,Bangalore,Space Technology and Defense,Pixxel is a Bengaluru-based space technology startup building a constellation of advanced earth imaging small satellites.,"Awais Ahmed, Kshitij Khandelwal","Techstars, Ryan Johnson",7300000.0,validation,2021-01-01
Prescinto,1970,Gujarat,Solar,Prescinto is the brain of a solar plant delivering Actionable Intelligence to Increase Generation.,Puneet Jaggi,"Venture Catalysts, 9Unicorns Accelerator Fund",3500000.0,validation,2021-01-01
MyGlamm,1970,Mumbai,"Cosmetics, Personal Care, and Beauty Products",MyGlamm is a direct-to-consumer brand of award winning European beauty products.,Darpan Sanghvi,Bessemer Venture Partners,20000000.0,early traction,2021-01-01
Chirrup,1970,Bangalore,Gaming,Video integrated social-gaming platform,"Vipul Garg, Sourav Lashkari, Mehul Mittal","Titan Capital, iSeed, First Cheque, 3.0 Fund.",300000.0,validation,2021-01-01
Policybazaar,1970,Gurgaon,Insurance,PolicyBazaar designs an online life insurance and general insurance comparison portal that analyzes financial products.,"Alok Bansal, Avaneesh Nirjar, Manoj Sharma, Tarun Mathur, Yashish Dahiya","Falcon Edge Capital, White Oak Global Advisors",75000000.0,others,2021-01-01
Livve Homes,1970,Bangalore,Rental Services,"India's homegrown online portal, championing the region for a brighter, more exciting livvable future. Right from simply connecting owners and tenants and to managing everything in between",Maya Lakshman,Angel investors,5000000.0,others,2021-01-01
Juicy Chemistry,1970,Coimbatore,HealthCare,Juicy Chemistry operates as an eponymous consumer brand.,"Megha, Pritesh Asher.",Akya Ventures,6300000.0,early traction,2021-01-01
Svasti Microfinance,1970,Mumbai,Fintech,Svasti works with urban slum dwellers women microentrepreneurs.,"Arunkumar Padmanabhan, Narayanan Subramaniam","Kayenne Ventures, Nordic Microfinance Initiative",4000000.0,others,2021-01-01
Nexprt,1970,Delhi,Consulting,Nexprt Solutions offers end-to-end and 100% customized import solutions.,Harsha Vardhan K,Titan Capital,2000000.0,others,2021-01-01
Wysa,1970,Bangalore,Artificial Intelligence,Wysa is an AI conversational agent that has been shown to help improve mental health,"Jo Aggarwal, Ramakant Vempati","Kae Capital, Pi Ventures",0.0,others,2021-01-01
Ankur capital,1970,Mumbai,Fintech,Early stage venture capital fund focused on opportunities created by rising aspirations & digital access for next billion Indians.,Ritu Verma,,40000000.0,others,2021-01-01
Indifi,1970,Gurgaon,Fintech,Indifi Technologies is a digital lending platform that offers loans to those that have potential and intent.,"Alok Mittal, Siddharth Mahanot, Sundeep Sahi","Elevar Equity, Accel India",5000000.0,others,2021-01-01
Firmway,1970,Mumbai,Fintech,Firmway is a platform that digitizes balance confirmation and reconciliation process.,"Prashant Gupta, Vivek Chandan",,0.0,validation,2021-01-01
Say Cheese,1970,Mumbai,Femtech,"Say Cheese is the first holistic women-happiness platform in India, focused to increase the happiness of women through personalized solutions",Rajpreet Kaur,,1000000.0,validation,2021-01-01
Indic Inspirations,1970,Pune,Cultural,"Indian Souvenirs online that reflect Indian tradition, culture & stories. Best for personal gifting and corporate gifting.",Sunil Jalihal,Marquee investors,300000.0,others,2021-01-01
Bimaplan,1970,Mumbai,Fintech,Affordable insurance for the next billion Indians,Vikul Goyal,"Titan Capital, Y Combinator",500000.0,validation,2021-01-01
YAP,1970,Chennai,Fintech,YAP is the API Platform for Banking and Payments products in Asia. More than 200 Fintechs across Asia rely on YAP,"Madhusudanan R, Prabhu R","Jitendra Gupta, Better Capital",10000000.0,early traction,2021-01-01
Leap Finance,1970,Bangalore,Fintech,Leap Finance is a fintech startup for Indian students pursuing international higher education,Vaibhav Singh,Jungle Ventures,17000000.0,early traction,2021-01-01
BlackSoil NBFC,1970,Mumbai,Fintech,BlackSoil Capital has transformed into an alternative NBFC and AIF Fund platform with an expertise to finance multiple sectors.,Mohinder Pal Bansal,,3000000.0,others,2021-01-01
OYO,1970,Gurgaon,Hospitality,OYO operates a branded network of hotels designed to offer standardized stay experiences.,Ritesh Agarwal,Hindustan Media Venture,200000000.0,others,2021-01-01
Max Healthcare,1970,Delhi,HealthCare,Max Healthcare is one of the leading chain of hospitals in India.,Analjit Singh,"Radiant Life Care Private Ltd, Life Healthcare",140000000.0,others,2021-01-01
4baseCare,1970,Bangalore,Healthcare,4baseCare develops a unified and patient-centric ecosystem to fight cancer.,"Hitesh Goswami, Kshitij Rishi","Mount Judi Ventures, growX Ventures, Season Two Ventures",2000000.0,early traction,2021-01-01
Ezstays,1970,Delhi,Education Technology,"Ezstays is a leading student-life network, providing hostels and PG accommodation with top-tier living facilities at the best prices.","Vaibhav Khanna, Abhishek Kumar, Kumar Gaurav",Richard Rekhy,400000.0,validation,2021-01-01
Stylework,1970,Gurgaon,Co-working,Stylework is an unconventional co-working space aggregator that is going to change the way people work.,Sparsh Khandelwal,Inflection Point Ventures,500000.0,early traction,2021-01-01
Kinara Capital,1970,Bangalore,Fintech,Kinara Capital is a financing company that provides flexible collateral-free loans to small business entrepreneurs.,Hardika Shah,"GAWA Capital, Gaja Capital",6000000.0,others,2021-01-01
Riskcovry,1970,Bangalore,Insurance,"Riskcovry is an ""Insurance-in-a-box” model offers a one-stop-shop platform to cater to any business's digital insurance needs.","Suvendu Prusty, Sorabh Bhandari, Vidya Sridharan, Chiranth Patil","Better Capital, Bharat Inclusion Seed Fund",5000000.0,early traction,2021-01-01
NODWIN,1970,Gurgaon,Gaming,NODWIN Gaming is a gaming solutions company and creator of e-sports events.,Gautam Virk,Krafton,20000000.0,others,2021-01-01
Quizizz,1970,Bangalore,Education Technology,Quizizz is a Education based startup,"Ankit Gupta, Deepak Joy Cheenath","Eight Roads Ventures India, Nexus Venture Partners",12500000.0,early traction,2021-01-01
Ecom Express,1970,Delhi,Business-to-Business E-commerce,Ecom Express is an end-to-end technology-enabled logistics solutions provider to the Indian e-commerce industry.,"K. Satyanarayana, Manju Dhawan, Sanjeev Saxena, T. A. Krishnan","CDC Group, Partners Group",20000000.0,others,2021-01-01
Turtlemint,1970,Mumbai,Insurance,Turtlemint is an online insurance platform that identifies and purchases appropriate insurance policies for consumers.,"Anand Prabhudesai, Dhirendra Mahyavanshi, Kunal Shah",Jungle Ventures,45000000.0,early traction,2021-01-01
Captain Fresh,1970,Bangalore,Supply Chain and Logistics,Captain Fresh is a freshwater fish and seafood supply chain platform.,Utham Gowda,"Matrix Partners India, Ankur Capital",3000000.0,validation,2021-01-01
Northern Arc,1970,Chennai,Fintech,Northern Arc Capital (Formerly known as IFMR Capital) is a Non-Banking Finance Company.,Kshama Fernandes,"U.S. International Development Finance Corp, Asian Development Bank",10000000.0,others,2021-01-01
Qoohoo,1970,Bangalore,Social Media,A platform for creators to build immersive connections with their fans and followers and monetize them.,"Vimal Singh Rathore, Aseem Gupta",Angel investors,800000.0,validation,2021-01-01
IGL,1970,Mumbai,Gaming,Indian Gaming League is the premier eSports platform in India.,Yash Pariani,"Hungama, Hindustan Talkies",500000.0,others,2021-01-01
AMPM,1970,Gurgaon,Business-to-Business E-commerce,24*7 convenience store,Shubham Gupta,Agility Venture Partners,200000.0,others,2021-01-01
The ePlane,1970,Chennai,Drone Technology,"Transforming the mobility landscape using aerial transport. Currently, we build drones for industrial applications","Pranjal Mehta, Satyanarayanan Chakravarthy","Speciale Invest, Farid Ahsan",1000000.0,validation,2021-01-01
Cashify,1970,Gurgaon,Business-to-Business E-commerce,Cashify.in is an e-commerce platform for reselling used electronic gadgets.,"Amit Sethi, Mandeep Manocha, Nakul Kumar","Bessemer Venture Partners, CDH Investments",15000000.0,others,2021-01-01
Bijnis,1970,Delhi,Business-to-Business Services,Digitizing the Factories of the Unorganised Industries.,"Chaitanya Rathi, Shubham Agarwal, Siddharth Rastogi, Siddharth Vij","Sequoia Capital India, Matrix Partners India",0.0,others,2021-01-01
Questt,1970,Gurgaon,Education Technology,Questt is a homework app that allows teachers to allocate objective and subjective homework based on selected content.,"Akhil Singh, Mohsin, Rohit Pande","Chiratae Ventures, AET Fund",1000000.0,validation,2021-01-01
DealShare,1970,Jaipur,Business-to-Business E-commerce,DealShare is a Social Commerce Startup,"Sankar Bora, Sourjyendu Medda, Vineet Rao","Omidyar Network, Falcon Edge Capital",3000000.0,others,2021-01-01
Euler Motors,1970,Delhi,Automotive,Electric Light Commercial Vehicle,Saurav Kumar,"Jetty Ventures, Srinivas Anumolu",4000000.0,early traction,2021-01-01
Blume Ventures,1970,Mumbai,Fintech,Blume Ventures provides pre-series A and early stage funding to tech-focused/tech-enabled ventures.,"Karthik Reddy, Sanjay Nath",Avendus,40000000.0,others,2021-01-01
KoineArth,1970,Bangalore,Blockchain startup,"Koinearth is a stealth mode startup working at the intersection of blockchains, machine learning and mechanism design",Praphul Chandra,YourNest,1800000.0,early traction,2021-01-01
ImaginXP,1970,Pune,Education Technology,ImaginXP is a curriculum company with a focus on training and certification in UX Design and Design Thinking.,Vidhika Rohatgi,Venture Catalysts,1500000.0,others,2021-01-01
Virohan,1970,Gurgaon,Education Technology,Virohan is an edtech company using technology to prepare a future-ready workforce for the healthcare industry.,"Archit Jayasal, Kunaal Dudeja, Nalin Saluja","National Skill Development Corporation, Rianta Capital",0.0,others,2021-01-01
Apna.co,1970,Bangalore,Recruitment and Staffing,Apna is a recruitment platform that gives opportunities for blue or grey collar jobs.,Nirmit Parikh,"Sequoia Capital India, Rocketship.vc",12500000.0,others,2021-01-01
ideaForge,1970,Mumbai,Drone Technology,ideaForge is an Indian company engaged in the development of unmanned aerial systems.,"Ankit Mehta, Ashish Bhat","Infosys, Qualcomm Ventures",2000000.0,others,2021-01-01
Clairco,1970,Bangalore,"Renewable Energy, Environmental Services, and Clean Technology",Clairco provides enhanced air purification and real-time insights for breathable air indoors.,Aayush Jha,"Real Estate Accelerator Program (REAP), AngelList",500000.0,others,2021-01-01
Northern Arc,1970,Chennai,Fintech,Northern Arc Capital (Formerly known as IFMR Capital) is a Non-Banking Finance Company.,Kshama Fernandes,"Asian Development Bank, U.S. International Development Finance Corp",50000000.0,others,2021-01-01
