company_brand,founded,headquarter,sector,about_company,founders,investor,amount,series,year
Jiffy ai,1970,,AI,Enterprise automation startup,Babu Sivadasan,Nexus Venture Partners,18000000.0,early traction,2020-01-01
Postman,1970,,Tech,API development platform startup,"Abhijit Kane, Abhinav Asthana, Ankit Sobti",Insight Partners,150000000.0,early traction,2020-01-01
F5,1970,,Retail Aggregator,It provides opportunities for its partner vendors to upsell and cross-sell their products.,"Raghav Arora, Lalit Kumar Aggarwal",Venture Catalysts,0.0,others,2020-01-01
Waycool,1970,Chennai,Agricultural Technology,Food development and distribution services,"Karthick Jayraman, Sanjay Dasari",Induslnd Bank,5500000.0,early traction,2020-01-01
Myelin Foundry,1970,,Deep Tech AI,"It builds AI based algorithms on video, voice and sensor","Dr Gopichand Katragadda, Ganesh Suryanarayanan, Aditi Olemann.",Pratithi,0.0,others,2020-01-01
Ameliorate Biotech,1970,Bangalore,Biotech,"Their products address the needs in Early Stage Diagnostics, Bio-Similars and Nutraceuticals.","Dr Binita Shrivastava Tunga, Dr Rashbehari Tunga","PadUp, Villgro USA, Vinners, LetsVenture, SINE IIT Bombay, DERBI",264000.0,validation,2020-01-01
Hapramp,1970,Gurgaon,Blockchain,Startup working on technologies like blockchain and social media,"Shubhendra Vikram, Ankit Kumar",Anand Mahindra,1000000.0,others,2020-01-01
MyKaam,1970,Bangalore,HrTech,Online job searching and recruiting platform,Ashish Gupta,"Dr Apoorva Ranjan Sharma, Mrunal Jhaveri, Nirav Panchmatia, Vikas Kapoor, Karan Garg",0.0,others,2020-01-01
HealthPlix,1970,Bangalore,Healthcare,It provides clinical software for doctors,"Raghuraj Sunder Raju, Prasad Basavaraj, Sandeep Gudibanda","JSW Ventures, Chiratae Ventures, Kalaari Capital",6000000.0,early traction,2020-01-01
YoloBus,1970,Gurgaon,Transportation and Mobility,Intercity bus service startup,"Shailesh Gupta, Mukul Shah",Nexus Venture Partners,3300000.0,early traction,2020-01-01
iNurture Education,1970,,Education Technology,"It provides a conducive and healthy teaching, learning environment",Ashwin Ajila,Kimera Ltd,4000000.0,others,2020-01-01
Pocket52,1970,Bangalore,Gaming,An online poker playing platform,Nitesh Salvi,Gameskraft,1750000.0,early traction,2020-01-01
QuaQua,1970,Hyderabad,Travel,Virtual travel guide platform,"Purav Shah, Sandesh Reddy",Anthill Ventures,1000000.0,others,2020-01-01
Crofarm,1970,Delhi,Agricultural Technology,Supply chain that supports farmers and provides businesses with freshest produce,"Prashant Jain, Varun Khurana",Smile group,1000000.0,others,2020-01-01
Timios,1970,Bangalore,Food and Beverages,Provides healthy snacks for kids,Aswani Chaitanya,Rangsons Technologies,0.0,early traction,2020-01-01
Wooden Street,1970,Jaipur,Ecommerce,It enables to order custom furniture online,"Lokendra Ranawat, Dinesh Pratap Singh, Virendra Ranawat, Vikas Baheti",IAN Fund,3000000.0,early traction,2020-01-01
BankBazaar,1970,Chennai,Fintech,Online marketplace that gives customers instant customised offers on loans and credit cards,"Adhil Shetty, Arjun Shetty, Rati Shetty,",WSV Capital,5967000.0,early traction,2020-01-01
Rentmojo,1970,Bangalore,Rental Services,"Rental platform for furniture, appliances & electronics",Geetansh Bamania,"Gautam Dalmia, Pratithi Investment Trust, Shri Investment",2980000.0,others,2020-01-01
Credgencies,1970,,AI & Debt,Tech-enabled platform for resolution of non-performing assets,"Rishabh Goel, Anand Agrawal, Mayank Khera",Titan Capital,0.0,validation,2020-01-01
Knorish,1970,Delhi,SaaS/Edtech,All-in-one knowledge commerce SaaS platform,"Kinner N Sacchdev, Rakhi Wadhwa",100x VC,323000.0,early traction,2020-01-01
LetsTransport,1970,Bangalore,Transportation and Mobility,Offers techno logistics solutions,"Pushkar Singh, Sudarshan Ravi, Ankit Parasher",Black Soil,1326000.0,others,2020-01-01
Vahak,1970,,Transportation and Mobility,It enables logistic companies to conncet with transporters,"Karan Shaha, Vikas Chandrawat","Leo Capaitals, Amit Gupta, Abhishek Goyal, Ramakant Sharma, Harsh Pokhran",0.0,validation,2020-01-01
Nutrova,1970,Mumbai,Nutrition and Nutrition Technology,"Nutraceutical company developing evidence-based nutrition and nutraceutical products,",Akshay Pai,DSG Consumer Partners,0.0,early traction,2020-01-01
Cube Wealth,1970,Mumbai,Software-as-a-Service,A digital wealth management services,"Satyen Kothari, Beenext, Asuka Holding","Beenext, Asuka Holding",500000.0,scaling,2020-01-01
IVF Access,1970,Bangalore,Healthcare,It provdes IVF treatments,"Naresh Rao, Nikhil Rajmohan, Harinath Chakravarthy, Pravin Sethuraman",Vertex Ventures SEA & India,5000000.0,early traction,2020-01-01
Hoi Foods,1970,Delhi,Food and Beverages,Quality food solution,Indrajeet Roy,Crowd Fund,2000000.0,early traction,2020-01-01
Ola Financial Services,1970,Bangalore,Fintech,It operates Ola Money,Bhavish Aggarwal,Matrix Partners,27000000.0,early traction,2020-01-01
Awifs,1970,Delhi,Co-working,Provides office space solutions,Amit Ramani,"Bisque Limited, Link Investment Trust.",5200000.0,others,2020-01-01
Dunzo,1970,Bangalore,Supply Chain and Logistics,India-based hyperlocal delivery startup,"Kabeer Biswas,  Mukund Jha, Dalvir Suri, Ankur Aggarwal",Undisclosed,55000000.0,others,2020-01-01
Swiflearn,1970,Gurgaon,Education Technology,Learning platform for K-10 students looking for personalised learning,"Abhinav Agarwal, Anand Bakode","Stellaris Venture Partners, Venture Highway",0.0,validation,2020-01-01
Remedo,1970,Delhi,Healthcare,The platform connects doctors with patients,"Dr Ruchir Mehra, Harsh Bansal, Richeek Arya",River Rock Ventures. Inflection Point Ventures,0.0,early traction,2020-01-01
Blowhorn,1970,Bangalore,Supply Chain and Logistics,Tech platform that connects logistics service seekers with mini-truck drivers,"Mithun Srivatsa, Nikhil Shivaprasad",Trifecta Capital,0.0,others,2020-01-01
Toch,1970,Mumbai,AI,"Helps online video creators, media companies, advertisers, and OTT platforms optimise their videos","Vinayak Srivastav, Saket Dandotia, Alok Patil","Chinaccelerator, 9 Unicorns Fund, Inflection Point Ventures",1000000.0,early traction,2020-01-01
Gram Cover,1970,Noida,Insurance,It provides insurance products in rural areas,Jatin Singh,"EMVC, Flourish, Omidyar Network India",0.0,early traction,2020-01-01
Coin DCX,1970,Mumbai,Cryptocurrency,Hybrid crypto exchange platform,"Sumit Gupta, Neeraj Khandelwal",Polychain Capital,2500000.0,others,2020-01-01
HomeCapital,1970,Mumbai,Fintech,Home Down Payment Assistance Program,Lalit Menghani,Varanium NexGen Fund,0.0,others,2020-01-01
Euler Motors,1970,Delhi,Automotive,Startup focusses on electric vehicles,Saurav Kumar,Inventus III India Fund,2530000.0,early traction,2020-01-01
Riskcovry,1970,Mumbai,Insurance,Offers various insurance products,"Suvendu Prusty, Sorabh Bhandari, Chiranth Patil.","Bharat Inclusion Seed Fund, Varanium Capital, and Better Capital",0.0,early traction,2020-01-01
NWNT (No Worry No Tension Healthcare),1970,Delhi,Healthcare,Mental healthtech startup,Sandeep Vohra,Amit Burman,0.0,early traction,2020-01-01
Voicezen,1970,Gurgaon,AI,Conversational AI startup,Anurba Nath,Bharti Airtel,0.0,others,2020-01-01
Leap Club,1970,Gurgaon,Fintech,Community led professional network for women,"Ragini Das, Anand Sinha","Whiteboard Capital, FirstCheque, Artha India Ventures, Sweta Rau, Deepak Abbot, Amrish Rau, Harpreet Singh Grover",340000.0,validation,2020-01-01
Credit Mantri,1970,Chennai,Fintech,Offers free credit score and a detailed credit analysis report,"Gowri Mukherjee, Ranjit Punja, Rajasundaram Sudarshan","IDG Ventures, Elevar Equity, Accion",792000.0,others,2020-01-01
Xtracap,1970,Gurgaon,Fintech,"Offers online payment solution,schemes, order management, insurance etc.,",Mohammed Riaz,Angel Investors,1000000.0,others,2020-01-01
Tring,1970,Mumbai,Media and Entertainment,Celebrity engagement platform,"Akshay Saini, Rahul Saini, Pranav Chabhadia","Kalyan Krishnamurthy, Sujeet Kumar, Keshav Sanghi, Roman Saini, Sumit Jain, Hemesh Singh",0.0,others,2020-01-01
Vakilsearch,1970,Chennai,Legal,"Online platform for legal, tax and compliance services",Hrishikesh Datar,Sujeet Kumar,0.0,others,2020-01-01
Khatabook,1970,Bangalore,Fintech,It helps SMEs to maintain their accounts and ledger online.,Ravish Naresh,B Capital Group,60000000.0,early traction,2020-01-01
LendingKart,1970,Ahmedabad,Fintech,Provides working capital loans and business loans to MSMEs,"Harshvardhan Lunia, Mukul Sachan","Fullerton Financial Holdings, Bertelsmann India Investments, Sistema Asia Fund, IndiaQuotient",11363000.0,early traction,2020-01-01
Illumnus,1970,,Education Technology,Offers Collaborative learning management system for educational institutions,"Akash Deep Singhal, Akshaya Singhal",Angel investors. HNI,100000.0,validation,2020-01-01
LetsTransport,1970,Bangalore,Transportation and Mobility,Offers techno logistics solutions,"Pushkar Singh, Sudarshan Ravi, Ankit Parasher",Innoven Capital,1715000.0,others,2020-01-01
Eggoz,1970,Bihar,Agricultural Technology,"Provides technology backed, deep integration services to egg farmers",Uttam Kumar,"Tracxn Labs, Angellist, Tri-Deep Capital",329000.0,validation,2020-01-01
Winuall,1970,Bangalore,Education Technology,It helps coaching institutes in digitization,Ashwini Purohit,"Ankit Bhati, Nitin Gupta",0.0,others,2020-01-01
Indian School Finance Company,1970,Hyderabad,Fintech,NBFC that provides funding to education system,,Gray Matters Capital,5271000.0,validation,2020-01-01
Juicy Chemistry,1970,,Fintech,It focuses on organic based skincare products,Pritesh Asher,Akya Ventures,650000.0,early traction,2020-01-01
DeepTek,1970,Pune,Healthcare,AI enabled radiology platform,"Amit Kharat, Ajit Patil, Aniruddha Pant",GHV Accelerator,0.0,others,2020-01-01
Stepathlon Lifestyle,1970,Mumbai,Fitness,It organises corporate wellness programs,"Krishnan, Shane Bilsborough","Josh Liberman, Mark Adams",0.0,others,2020-01-01
Sindhuja Microcredit,1970,Noida,Fintech,It provides financial services to self employed women entrepreneurs,"Abhisheka Kumar, Malkit Didyala",Nordic Microfinance Initiative,8700000.0,others,2020-01-01
Rentmojo,1970,Bangalore,Rental Services,"Rental platform for furniture, appliances & electronics",Geetansh Bamania,"Chiratae Ventures, Accel Partners, BCIP Venture Associates, Bain Capital, Renaud Laplanche",3226000.0,others,2020-01-01
Tesco Charge Zone,1970,Gujarat,EV,Operates electric vehicle charging zone,Kartikey Hariyani,Mumbai Angels Network,0.0,others,2020-01-01
Intello Labs,1970,Gurgaon,Supply chain,Standardisation and Quality control of fruits & vegetables,"Milan Sharma, Nishant Mishra, Himani Shah, Devendra Chandani",Saama Capital,5900000.0,early traction,2020-01-01
SirionLabs,1970,Gurgaon,Software-as-a-Service,"Provides procurement, outsourcing services & contract management software",Ajay Agrawal,"Tiger Global, Avatar Growth Capital",44000000.0,early traction,2020-01-01
Magicpin,1970,Gurgaon,Fintech,"It is a local discovery, rewards, and commerce platform","Anshoo Sharma, Brij Bhushan",Lightspeed Venture Partners,3879000.0,others,2020-01-01
GroCurv,1970,Gurgaon,B2B,"It offers a wide range of business related services like Branding, marketing, sales etc.,","Venkatesh Rangachari, Vipul Gupta",Unicorn Investments Pte Ltd,0.0,validation,2020-01-01
Refrens,1970,Bangalore,Software-as-a-Service,"Offers a free invoicing, payments and expense management system","Naman Sarawagi, Mohit Jain","Vijay Shekhar Sharma, Anupam Mittal",1000000.0,validation,2020-01-01
Shiprocket,1970,,Transportation and Mobility,Tech enabled logistics aggregator,Saahil Goel,"Tribe Capital, Innoven Capital, BII",13000000.0,early traction,2020-01-01
Spyne,1970,Gurgaon,AI,Helps online businesses with visual content,"Sanjay Kumar, Deepti Prasad","Angellist, Smile Group, Manish Amin, Anil Goel, Anubhav Sonthalia, Deepak Mittal",0.0,early traction,2020-01-01
Nykaa,1970,Mumbai,Ecommerce,Deals in cosmetic and wellness products,Falguni Nayar,Steadview capital,8800000.0,others,2020-01-01
Docsapp,1970,Bangalore,Healthcare,Online doctor consultation app,Satish Kannan,"Bessemer Venture Partners India, Fusian Capital, Rebright Partners, Milliways Fund LLC",9500000.0,others,2020-01-01
Phable,1970,,Healthcare,"It creates an engagement loop between doctors, hospitals, and patients via its app","Sumit Sinha,  Mukesh Bansal",Inflection Point Ventures,1000000.0,early traction,2020-01-01
Generic Aadhaar,1970,,Pharmaceuticals,It provides a platform for entrepreneurs to access generic  medicine at low cost,Arjun Deshpande,Ratan Tata,0.0,others,2020-01-01
Nium,1970,,Fintech,Open global money platform,Prajit Nanu,"VisaVentures, BRI Ventures",0.0,others,2020-01-01
Mintoak,1970,Mumbai,Fintech,Merchant payment solutions startup,"Raman Khanduja, Sanjay Nazareth",Pravega Ventures,2000000.0,early traction,2020-01-01
VestSpace,1970,Pune,Space Technology and Defense,It builds small satellite paltforms,Arun Kumar Sureban,Next Capital,10000000.0,others,2020-01-01
Blackbuck,1970,Bangalore,Supply Chain and Logistics,Provides trucking services,Rajesh Yabaji,Trifecta Venture,0.0,others,2020-01-01
Vernacular ai,1970,Bangalore,AI,It offers Multiligual AI platform,"Gupta, Akshay Deshraj, Manoj Sarda","Exfinity Ventures, IAN Fund",5100000.0,early traction,2020-01-01
Clover,1970,Bangalore,Agricultural Technology,Provides agricultural solution to farmers working in the greenhouse production of vegetables and fruits,"Avinash BR, Gururaj Rao, Arvind Murali, Santhosh Narasipura",Alteria Capital,920000.0,others,2020-01-01
Varthana,1970,Bangalore,Fintech,Offers secured and unsecured loans,Steve Hardgrave,ChrysCapital,15000000.0,early traction,2020-01-01
Codeninja,1970,Bangalore,Software-as-a-Service,AI-powered 'no-code' platform which can generate application development code,"Prashanth Kuppur, Deepak Kalhan, Saurabh Kukreti, Richpal Gora","Hari Balasubramanian, EaSyndicate",0.0,validation,2020-01-01
MetaMerphoSys,1970,Pune,Insurance technology,Digital insurance platform for businesses,"Amit Naik, Kewal Vargante",Good Capital,0.0,early traction,2020-01-01
Rooter,1970,Delhi,Gaming,Live sports engagement platform,"Piyush, Dipesh Agarwal","Paytm, leAD Sports, Rockstud Capital, Founder Bank Capital",1700000.0,early traction,2020-01-01
Aker Foods,1970,Pune,Foodtech & Logistics,Ai driven supply chain platform,Suraj Saste,Mumbai Angels Network,0.0,others,2020-01-01
Sascan Meditech pvt ltd,1970,Kochi,Healthcare,They are developing technology that can detect early cancerous cells,Dr Subhash Narayanan,Unicorn India Ventures,0.0,others,2020-01-01
DailyHunt,1970,,Media and Entertainment,News aggregator,Virendra Gupta,Lupa India,35600000.0,others,2020-01-01
Pratilipi,1970,Bangalore,Media and Entertainment,A digital platform that connects readers and writers in various languages,"Ranjeet Pratap Singh, Sankaranarayanan Devarajan, Sahradayi Modi, Rahul Ranjan, Prashant Gupta",Tencent,9400000.0,early traction,2020-01-01
Biryani By Kilo,1970,Delhi,Food and Beverages,Online paltform to order biryani,Vishal Jindal,"Devanshu Dolat Desai, Anand M Khatau, Debasish Priyadarshi Purohit, Kaushik Shanghvi",790000.0,early traction,2020-01-01
Consure Medical,1970,Delhi,Healthcare,"Novel platform technologies to manage, diagnose, and treat various GI disorders","Nishith Chasmawala, Amit Sharma","Accel Partners, Jungle Ventures",480000.0,others,2020-01-01
Servify,1970,Mumbai,Fintech,It is a technology company which serves as a platform for brands to offer end-to-end solutions to their users,Sreevathsa Prabhakar,Barkawi,250000.0,others,2020-01-01
Tessol,1970,Mumbai,Supply Chain and Logistics,It provides end to end cold chain logistics solutions,Rajat Gupta,1Funds Domestic Scheme,160000.0,early traction,2020-01-01
Remedo,1970,Noida,Healthcare,"It helps doctors engage with patients, improve patient experience",Harsh Bansal,RiverRock Ventures,0.0,early traction,2020-01-01
News Reach,1970,Ahmedabad,Media and Entertainment,"It is a platform that digitalises local newspaper publishers, reporters, stringers by aggregating their content",Darshan Shah,Mumbai Angels Network,0.0,others,2020-01-01
RoomSoom,1970,Noida,Housing,It provides co-living and student rooms,"Nitin Agrawal, Garima Agrawal",Mumbai Angels Network,0.0,others,2020-01-01
Pedagogy,1970,,Education Technology,It has a single subscription model that allows users to access books and digital courses.,"Archin Shah, Abhilash Sonwane, Ritesh Gandhi",Inflection Point Ventures,400000.0,others,2020-01-01
Classplus,1970,Delhi,Education Technology,"It provides mobile-first software for coaching institutes, tuition centres and private tutors","Mukul Rustagi, Bhaswat Agarwal",RTP Global,8200000.0,early traction,2020-01-01
Medlife,1970,Bangalore,Pharmaceuticals,It solves inadequacies in the healthcare delivery system through technology,"Tushar Kumar, Prashant Singh",Hero Fincorp,15500000.0,others,2020-01-01
Qin1,1970,Noida,Education Technology,It is alearning platform for kids in the age group 5 to 14 yrs,"Ishan Gupta, Aarti Gupta",Venture Catalysts,0.0,others,2020-01-01
MYSUN,1970,Delhi,Tech,Platform for rooftop solar energy solutions,"Gagan Vermani, Divyanshu Sachdev, Gyan Prakash Tiwari",Undisclosed,4257000.0,early traction,2020-01-01
ShopX,1970,Bangalore,Ecommerce,B2B retail operating system,"Amit Sharma, Apoorva Jois",Li and Fung,1410000.0,others,2020-01-01
Sarva,1970,,Yoga & wellness,It drives a cultural change in making yoga-based wellness a part of modern lifestyle,Sarvesh Shashi,"Mantra Capital, Patni Family",0.0,others,2020-01-01
Expertrons,1970,Mumbai,AI,AI video bot platform for career hacks,"Vivek Gupta, Jatin Solanki","Nikhil Vora, Iceland Venture Studio, LetsVenture, Samyakth Capital",0.0,validation,2020-01-01
NewsBytes,1970,Gurgaon,Media and Entertainment,News portal,"Romesh Khaddar, Shikha Chaudhry, Sumedh Chaudhry",North Base Media,1500000.0,early traction,2020-01-01
Wagonfly,1970,Bangalore,Fintech,Contactless shopping and delivery experience by using radio frequency to tag retail items,Raghavendra Prasad,Investment Trust of India,500000.0,others,2020-01-01
NIRA,1970,,Fintech,It offers access and credit to working Indians,"Rohit Sen, Nupur Gupta",Angel investors,2100000.0,early traction,2020-01-01
Convosight,1970,Hyderabad,Analytics and Data Science,It helps business gain insights from its community on Facebook groups,"Tarun Dhamija, Kartik Bansal","IvyCap Ventures, Sequoia Capital",4000000.0,early traction,2020-01-01
Fittr,1970,Pune,Fitness,Fitness Social Network & Consultation Platform,Jitendra Chouksey,"Sequoia Capital Surge, Better Capital",2000000.0,others,2020-01-01
AsknBid,1970,Bangalore,Investment Tech,It builds algorithmic investing-based tech products,"Suresh Bavisetti, Paarth Dhar",Ravikanth Reddy & Mumbai Angel Network,0.0,others,2020-01-01
Bira91,1970,Bangalore,Beverage,Craft beer maker,Ankur Jain,"Sequoia Capital, Sofina",20000000.0,early traction,2020-01-01
Finaureus Technologies,1970,Pune,Fintech,Provides investment management solutions,"Arindam Ghosh, U R Bhatt",Pinetree Capital,0.0,early traction,2020-01-01
Daily Ninja,1970,Haryana,Ecommerce,Online Milk Delivery startup,Sagar Yarnalkar,Big Basket,349800.0,others,2020-01-01
Guvi Geek Network Pvt Ltd,1970,Chennai,Education Technology,Operates vernacular-language based education,"SP Balamurugan, Arun Prakash, Sri Devi",Education Catalyst Fund,786000.0,early traction,2020-01-01
LoadShare,1970,Bangalore,Supply Chain and Logistics,Provides technology based solutions to SMEs in logistics,"Raghuram Talluri, Tanmoy Karmakar, Rakib Ahmed",CDC Group,2004000.0,early traction,2020-01-01
Vedantu,1970,Bangalore,Education Technology,Onine learning platform,"Saurabh Saxena, Pulkit Jain, Anand Prakash, Vamsi Krishna",KB Global Platform Firm,6800000.0,early traction,2020-01-01
Indusface,1970,,Information Technology,It provides IT security solutions,"Venkatesh Sundar, Nandini Tandon",Tata Capital Growth Fund II,5000000.0,others,2020-01-01
DMI Group,1970,Delhi,Financial Services,Pan-India Credit providing platform,"Shivashish Chatterjee, Yuvraja Singh",NXC Corporation,123000000.0,others,2020-01-01
Spintly,1970,Goa,Internet of Things,It is a wireless cloud-based access control system,"Rohin Parkar, Malcolm Dsouza",Saltwater Venture Sparks,248000.0,early traction,2020-01-01
Credr,1970,Mumbai,Automotive,A marketplace to buy and sell used bikes and scooters,Mittal,Stride Ventures,0.0,others,2020-01-01
Bijak,1970,Gurgaon,Agricultural Technology,"It is a platform that gives agricultural commodity at better prices, increased working capital, and optimised logistics","Nukul Upadhye, Mahesh Jakhotia, Jitender Bedwal, Daya Rai, Nikhil Tripathi",RTP Global,12000000.0,early traction,2020-01-01
Bugworks,1970,Bangalore,Pharmaceuticals,A drug discovery company that aims to discover novel treatment options for resistant bacterial infections,Anand Anandkumar,"University of Tokyo Edge Capital, Global Brain Corporation",7500000.0,others,2020-01-01
DrinkPrime,1970,Bangalore,Fintech,Water purifier subscription service,"Manas Ranjan Hota, Vijender Reddy","Abhishek Goyal, Bharat Jaisinghani, FirstCheque",0.0,validation,2020-01-01
Yap,1970,Chennai,Fintech,Banking and payment products-focused API platform,"Madhusudanan R, Muthukumar and Prabhu",BeeNext,4500000.0,early traction,2020-01-01
UzhavarBumi,1970,Tamil Nadu,Dairy,Provides fresh dairy products,"Vetrivel Palani, Paneerselvam",Angel Network,0.0,others,2020-01-01
Tattva,1970,Delhi,"Cosmetics, Personal Care, and Beauty Products",Sells its organic and beauty products via marketplace,"Megha Wadhwa, Karnesh Mahendru","Sukhbir Singh, Rakhee Singal",150000.0,others,2020-01-01
Pariksha,1970,Pune,Education Technology,Platform for vernacular test-preparation,"Karanvir Singh, Utkarsh Bagri, Vikram Shekhawat, Deepak Choudhary","INSEAD Angels, IIT Kanpur Angels, Sixth Sense Ventures, Saahil Bhatia",0.0,early traction,2020-01-01
DailyHunt,1970,,Media and Entertainment,News aggregator,Virendra Gupta,"Bytedance, Falcon Edge, Goldman Sachs, Advent Management",24000000.0,others,2020-01-01
NoBroker,1970,Bangalore,Real Estate and Property Technology,Online real estate rental startup,"Amit Kumar Agarwal, Akhil Gupta, Saurabh Garg",General Atlantic,30000000.0,others,2020-01-01
Box8,1970,Mumbai,Food and Beverages,Enables to order food online,"Amit Raj, Anshul Gupta","IIFL Seed Ventures Fund, Menlo park",4000000.0,others,2020-01-01
Capital Float,1970,Bangalore,Fintech,Online platform that provides working capital finance to SMEs,"Gaurav Hinduja, Sashank Rishyasringa","Ribbit Capital, SAIF Partners, Sequoia Capital India, Amazon",15000000.0,others,2020-01-01
ITILITE,1970,Bangalore,Travel & SaaS,Platform for business travel,"Mayank Kukreja, Anish Khadiya","Greenoaks Capital, Vy Capital. Matrix Partners India",13000000.0,early traction,2020-01-01
Morning Context,1970,,Media and Entertainment,A subscription-only digital media publisher,,Angel investors,0.0,validation,2020-01-01
Aavenir,1970,Ahmedabad,Software-as-a-Service,Source-to-Pay Software,Ashish Bhandari,Accel,2000000.0,validation,2020-01-01
Savvy Co op,1970,,Healthcare,It connects patients with healthcare companies,Jen Horonjeff,Indie VC,0.0,others,2020-01-01
BLive,1970,,Tourism & EV,"It offers experiential, guided tours on smart electric bikes","Samarth Kholkar, Sandeep Mukherjee",Mumbai Angels Network,0.0,early traction,2020-01-01
Yellow Messenger,1970,Bangalore,AI,It offers conversational chatbots,Raghavendra Kumar Ravinutala,"Lightspeed Venture Partners, Lightspeed India Partners.",20000000.0,early traction,2020-01-01
Toch,1970,,Media and Entertainment,AI based Video object detection and Tagging platform,"Vinayak Shrivastav, Saket Dandotia, Alok Patil",Inflection Point Ventures,400000.0,others,2020-01-01
Ewar,1970,Bangalore,Gaming,E-sports and real-time gaming startup,"Parth Chadha, Rahul Singh","Jindal Steels, Jeet Banerjee",200000.0,others,2020-01-01
Setu,1970,,Fintech,"Offers open APIs across four categories: bills, savings, credit, and payments.","Sahil Kini, Nikhil Kumar","Lightspeed Venture, Falcon Edge, Bharat Inclusive Technologies Seed Fund.",14259000.0,early traction,2020-01-01
Wellthy Therapeutics,1970,Bangalore,Healthcare,It offers a digital therapeutics service,Abhishek Shah,Saama Capital,4000000.0,early traction,2020-01-01
Power Gummies,1970,Delhi,Healthcare,Offers health supplements related gummies,Divij Bajaj,Venture Catalysts,0.0,others,2020-01-01
Locale ai,1970,Bangalore,Analytics and Data Science,It helps companies with moving assets  increase revenues and demand using real time location data and analytics,"Rishabh Jain, Aditi Sinha",Better Capital,0.0,others,2020-01-01
FarEye,1970,Delhi,Supply Chain and Logistics,"It enables businesses to execute, track, predict and oprimize the movements of goods","Gaurav Srivastava, Gautam Kumar, Kushal Nahata","M12, Honeywell venture capital, Eight Roads Venture",24500000.0,early traction,2020-01-01
Rebel Foods,1970,,Food and Beverages,It runs internet kitchen,"Jaydeep Barman, Kallol Bannerjee",Coatue Management,50000000.0,others,2020-01-01
BankBazaar,1970,Chennai,Fintech,Online marketplace that gives customers instant customised offers on loans and credit cards,"Adhil Shetty, Arjun Shetty, Rati Shetty,","Amazon, Sequoia, Walden SKT Venture Fund",3800000.0,early traction,2020-01-01
Porter,1970,Mumbai,Supply Chain and Logistics,Logistics and fleet management,"Pranav Goel, Uttam Digga",Lightstone Global Funds,18370000.0,early traction,2020-01-01
SugarBox,1970,Mumbai,Tech,Hyperlocal data distribution platform,Rohit Paranjpe,Zee Entertainment Enterprises Limited,68525000.0,others,2020-01-01
Capital Float,1970,Bangalore,Fintech,Online platform that provides working capital finance to SMEs,"Gaurav Hinduja, Sashank Rishyasringa","Amazon Inc`, Dinesh J Hinduja",4800000.0,early traction,2020-01-01
